{
  "$schema": "./episode.schema.json",
  "id": "episode-004",
  "series": "Мемы Рунета",
  "hook": {
    "bait": "ОСТОРОЖНО 18+",
    "baitImage": "images/hooks/episode-004-approved.webp",
    "baitReveal": "ДА НЕТ 😏\nЭТО ВСЕГО ЛИШЬ ВИКТОРИНА",
    "baitDuration": 3,
    "baitRevealDuration": 2,
    "baitBlur": 0,
    "title": "СЕЙЧАС БУДУТ МЕМЫ РУНЕТА",
    "subtitle": "УГАДАЙ МЕМ ПО 4 КАДРАМ"
  },
  "theme": "cyber-sunset",
  "question": "УГАДАЙ МЕМ РУНЕТА",
  "levels": [
    {
      "answer": "ТОЛИК-ЕБОЛИК, ПЕРВЫЙ ДЕНЬ НА РАБОТЕ",
      "difficulty": "easy",
      "revealAudio": "audio/memes/tolik-ebolik.mp3",
      "revealAudioVolume": 1,
      "clues": [
        {
          "image": "images/memes/tolik-ebolik/clue-1.jpg"
        },
        {
          "image": "images/memes/tolik-ebolik/clue-2.jpg"
        },
        {
          "image": "images/memes/tolik-ebolik/clue-3.jpg"
        },
        {
          "image": "images/memes/tolik-ebolik/clue-4.jpg"
        }
      ]
    },
    {
      "answer": "ЯК ЛЕВ РЫЧИТ",
      "difficulty": "medium",
      "clues": [
        {
          "image": "images/memes/lev-rychit/clue-1.jpg"
        },
        {
          "image": "images/memes/lev-rychit/clue-2.jpg"
        },
        {
          "image": "images/memes/lev-rychit/clue-3.jpg"
        },
        {
          "image": "images/memes/lev-rychit/clue-4.jpg"
        }
      ],
      "revealAudio": "audio/memes/lev-rychit.mp3",
      "revealAudioVolume": 1
    },
    {
      "answer": "ПОВАР СПРАШИВАЕТ ПОВАРА",
      "difficulty": "hard",
      "clues": [
        {
          "image": "images/memes/povar/clue-1.jpg"
        },
        {
          "image": "images/memes/povar/clue-2.jpg"
        },
        {
          "image": "images/memes/povar/clue-3.jpg"
        },
        {
          "image": "images/memes/povar/clue-4.jpg"
        }
      ],
      "revealAudio": "audio/memes/povar.mp3",
      "revealAudioVolume": 1
    },
    {
      "answer": "ТОЛИК, ЭТО ПОДЪЕЗД",
      "difficulty": "expert",
      "revealAudio": "audio/memes/tolik.mp3",
      "revealAudioVolume": 1,
      "clues": [
        {
          "image": "images/memes/tolik/clue-1.jpg"
        },
        {
          "image": "images/memes/tolik/clue-2.jpg"
        },
        {
          "image": "images/memes/tolik/clue-3.jpg"
        },
        {
          "image": "images/memes/tolik/clue-4.jpg"
        }
      ]
    }
  ],
  "boss": {
    "answer": "ВСЕГО ХОРОШЕГО! РУССКИЕ ИДУТ ДОМОЙ",
    "title": "BOSS",
    "subtitle": "ФИНАЛЬНЫЙ МЕМ",
    "revealAnswer": false,
    "commentPrompt": "УЗНАЛ? ПИШИ НАЗВАНИЕ МЕМА",
    "clues": [
      {
        "image": "images/memes/russkie-domoy/clue-1.jpg"
      },
      {
        "image": "images/memes/russkie-domoy/clue-2.jpg"
      },
      {
        "image": "images/memes/russkie-domoy/clue-3.jpg"
      },
      {
        "image": "images/memes/russkie-domoy/clue-4.jpg"
      }
    ],
    "revealAudio": "audio/memes/russkie-domoy.mp3",
    "revealAudioVolume": 1
  },
  "music": {
    "track": "music/monkeys-spinning-monkeys.mp3",
    "volume": 0.2,
    "sfxVolume": 0.48
  },
  "cta": {
    "headline": "УЗНАЛ ФИНАЛЬНЫЙ МЕМ?",
    "question": "СКОЛЬКО МЕМОВ УЗНАЛ ИЗ 5?",
    "subscribe": "ПОДПИШИСЬ — СЛЕДУЮЩАЯ ЧАСТЬ БУДЕТ ЕЩЁ ЖЁСТЧЕ"
  },
  "timing": {
    "hook": 7.5,
    "levelIntro": 0.7,
    "reveal": 3,
    "bossIntro": 1,
    "bossOutro": 3,
    "cta": 2.8
  },
  "meta": {
    "tags": [
      "memes",
      "runet",
      "quiz",
      "russian-memes"
    ],
    "language": "ru",
    "hook_variant": "user-supplied-18plus-silhouette",
    "asset_source": "Public source thumbnails; first meme from Tolik-ebolik original; approved user hook image",
    "audio_source": "source-video-clips",
    "goal": "runet-meme-quiz",
    "audio_status": "First two meme voice/audio clips required. Tracks 3-5 retained.",
    "music_source": "Monkeys Spinning Monkeys — Kevin MacLeod, CC BY 4.0"
  }
}
